,Unnamed: 0,AgtId,Con,Contp,Reg,Agt,Dat,Day,Month,Year,Status,Lgt,Agtp,Stage,StageSub,Part,ThrdPart,OthAgr,GCh,GChRhet,GChAntid,GChSubs,GChOth,GDis,GDisRhet,GDisAntid,GDisSubs,GDisOth,GAge,GAgeRhet,GAgeAntid,GAgeSubs,GAgeOth,GMig,GMigRhet,GMigAntid,GMigSubs,GMigOth,GRa,GRaRhet,GRaAntid,GRaSubs,GRaOth,GRe,GReRhet,GReAntid,GReSubs,GReOth,GInd,GIndRhet,GIndAntid,GIndSubs,GIndOth,GOth,GOthRhet,GOthAntid,GOthSubs,GOthOth,GRef,GRefRhet,GRefSubs,GRefOth,GSoc,GSocRhet,GSocAntid,GSocSubs,GSocOth,GeWom,GeMe,GeMeNu,GeMeOth,GeSo,GeFa,StDef,StGen,StCon,StSd,StRef,StSym,StInd,StUni,StBor,StXbor,Pol,PolGen,PolNewInd,PolNewTemp,ConRen,Cons,Ele,ElecComm,PolPar,Civso,Tral,Pubad,Polps,PpsSt,PpsSub,PpsEx,PpsOro,PpsOthPr,PpsVet,PpsAut,PpsInt,PpsOth,Terps,TpsSub,TpsLoc,TpsAut,TpsOth,Eps,EpsRes,EpsOth,Mps,MpsMe,MpsJt,MpsOth,HrGen,EqGen,HrDem,Prot,HrFra,HrfSp,HrfBor,HrfTinc,HrfOth,HrCp,CprLife,CprTort,CprEq,CprSlav,CprLib,CprDet,CprFmov,CprFspe,CprFass,CprTria,CprPriv,CprVote,CprReli,CprOth,HrSec,SerProp,SerWork,SerHeal,SerEdu,SerStdl,SerShel,SerSs,SerCult,SerOth,HrNi,HrNiMe,HrNiNe,HrNiOth,HrIi,HrIiMon,HrIiBod,HrIiOth,HrMob,HrDet,Med,MedGov,MedSubs,MedLog,MedOth,HrCit,CitGen,CitRights,CitDef,CitOth,JusCr,JusCrSp,JusCrSys,JusCrPow,JusEm,JusJu,JusPri,JusTra,Dev,NEC,NatRes,IntFu,Bus,Tax,TaxPo,TaxRef,TaxOth,Ban,CenBan,BanPers,BanInt,BanXb,LaRef,LaRefMan,LaRefRet,LaRefOth,LaNom,LaCH,LaCHTa,LaCHIt,LaCHPro,LaCHOth,LaEn,Wat,SsrGua,Ce,CeProv,CeGen,SsrPol,SsrArm,SsrDdr,DdrDemil,DdrProg,SsrInt,SsrPsf,SsrFf,Cor,SsrCrOcr,SsrDrugs,Terr,TjGen,TjAm,TjAmPro,TjSan,TjPower,TjCou,TjJaNc,TjJaIc,TjMech,TjPrire,TjVet,TjVic,TjMis,TjRep,TjRSym,TjRMa,TjNR,ImUN,ImOth,ImRef,ImPK,ImE,ImSrc,PeaceProcess,PeaceProcessN,UCDPc_code_old,conflict_id,In_other_UCDP,PAID_UCDP,PAM_ID,Date,Year.1,inclusion1,inclusion2,inclusion3,HumRiFrameALL,HumRiCivPolALL,HumRiSocEconALL,humanrightsALL,SecurityALL,Y-10,Y+10,Y-1,Y-2,Y-5,Y+1,Y+2,Y+5,IsLocationProvisional,Location1,IsGWNOprovisional,GWNO,ISONUM,ConShort,ISO3,Location2,GWNO2,ISONUM2,ConShort2,ISO3_2,WarNumCoW,WarNameCoW,yr,anypowersharing,anypowersharing_binom,Amnesty,TJ_bin,politicalps,territorialps,economicps,militaryps,womenandps,TJmechanism,Drugs,Corruption,Crime_Org_Crime
6,7,8,Gabon,Government,Africa (excl MENA),Accord de Paris,07/10/1994,7,10,1994,Multiparty signed/agreed,38,Intra,SubComp,FrAg,"For the Executive:
For the Democratic Party of Gabon (PDG), the Interim General Secretary: Honourable Leonard ANDJEMBE
For the Unity People’s Party (PUP), the President: M Louis Gaston MAYILA
For the Socialist Union of Gabon (USG), the First Secretary: Dr. Serge MBA BEKALE
For the Gabon Association for Socialism (APSG), the President: Victor MAPANGOU MUCANI MUETSA
For the Liberal Reform Convention (CLR), the President, Honourable Jean Boniface ASSELE

For the Opposition HCR
POLITICAL PARTIES
For the Democratic & Republican Alliance (ADERE), the President, Gaston Noel MBOUMBOU NGOMA
For the African Forum for Reconstruction (FAR), the First Secretary, Honourable Leon MBOU YEMBI
For the People’s Socialist Emancipation Movement (MESP), the Secretary General, Alfred ANTYUWE WORA
For the National Recovery Movement (MORENA), the President, Honourable Simon OYONO ABA’A
For the Independent Centre Party of Gabon (PGCI), the President, Jerome OKINDA
For the Progress Party of Gabon (PGP), the President, Me Pierre Louis AGONDJO OKAWE
For the Democratic Justice Congress (CDJ), the President, Marc Saturnin NAN NGUEMA
For the Radical Independent Republican Party (PARI), the President, Honourable Anacle BISSIELO
For the Social Democratic Party (PSD), the President, Pierre Claver MAGANGA MOUSSAVOU
For the United People’s Party (PUP-CRISE), the President, Paulin NSOME
For the National Assembly of Foresters (RNB), the President, Pere Paul MBA ABESSOLE
For the Gabon People’s Union (UPG), the President, Pierre MAMBOUNDOU
POLITICAL GROUPS
Group: Jules Aristide BOURDES OGOULIGUENDE
Group: Leon MEBIANE
Group: Alexandre SAMBAT
Group: Di Djob DIVUNGUI DI NDING
Group: Jean-Pierre LEMBOUMBA LEPANDOU
","International Observers
For the Republic of France
For the Republic of Congo
For the Republic of Benin
For the Federal Republic of Germany and the European Union
For Canada
The Mediator: H.E. Kemoke KEITA, Ambassador of Guinea, representing the Secretary General of the OUA
His Excellence El Hadj Omar Bongo, President of the Republic, Head of State
",,3,0,0,1,0,0,0,0,0,0,0,0,0,0,0,0,0,0,0,0,0,0,0,0,0,0,0,0,0,0,0,0,0,0,0,0,0,0,0,0,0,0,0,0,0,0,0,0,0,0,0,0,0,0,0,0,0,0,0,0,0,0,0,0,0,3,0,0,1,0,3,2,1,3,1,0,1,0,0,0,0,0,0,0,0,0,0,0,0,0,0,0,0,0,0,0,0,0,0,1,1,1,0,0,0,0,0,0,1,0,0,0,0,1,0,0,0,1,0,0,0,0,0,0,0,0,0,0,0,0,0,0,0,0,0,0,0,0,0,0,0,0,0,3,0,1,0,0,3,0,0,1,0,0,0,0,0,0,0,0,0,1,0,1,0,3,1,0,1,0,1,0,0,1,0,0,0,0,0,0,0,0,0,0,0,1,0,1,0,0,0,1,0,0,0,0,0,0,0,1,0,0,0,0,2,1,0,0,0,0,0,2,0,0,0,0,2,0,1,0,0,0,0,0,1,1,Gabon peace process,47,,,,,,07/10/1994,1994,3,3,4,0,2,0,7,2,1984.0,2004.0,1993.0,1992.0,1989.0,1995.0,1996.0,1999.0,0.0,Gabon,0.0,481.0,266.0,GAB,GAB,,,,,,,,1994,0,0,1,0,0,0,0,0,0,1,0,1,0
47,48,87,Nepal,Government,Asia and Pacific,Decisions of the Seven Party Alliance (SPA) - Maoist Summit Meeting,08/11/2006,8,11,2006,Multiparty signed/agreed,7,Intra,SubPar,MultIss,"Signatories:

Prachanda, Chairman, CPN (Maoist)
Girija Prasad Koirala, Prime Minister and President, Nepali Congress
Madhav Kumar Nepal, Secretary General, CPN (UML)
Sher Bahadur Deuba, President, Nepali Congress (Democratic)
Amik Sherchan, Deputy Prime Minister and Chairman, People’s Front Nepal
Bharat Bimal Yadav, Vice President, NSP (Anandi Devi)
Narayan Man Bijukchhe, President, NWPP
C.P. Mainali, Chairman, United Left Front

November 8, 2006

Note of dissent of the CPN (UML)

While agreeing to the implementation of the above as agreed by all other parties, our party records the following dissenting views:

1.	The CPN (UML) holds a dissenting view that the issue of whether or not to retain the institution of monarchy should be decided by a referendum held simultaneously with the election to the Constituent Assembly.
2.	The CPN (UML) holds a dissenting view that the most democratic method to elect the Constituent Assembly is the proportional system of election.

(Signed)

Madhav Kumar Nepal
Secretary General, CPN (UML)",,"Page 1, Untitled preamble:...Reaffirming full commitments to the 12-point understanding and the 8-point agreement concluded between the Seven Political Parties and the Maoists and the 25-point code of conduct along with all other agreements, understandings, codes of conduct concluded between the Government of Nepal and CPN-Maoists and the letters of similar spirit sent to the United Nations by the Government of Nepal and the Maoists;...

Page 1, II, Relating to the management of Army and Arms: The following shall be done in order for holding the election to the Constituent Assembly in a peaceful, fair and fearless environment and for the democratisation and restructuring of the Nepali Army in line with the spirit of the 12-point understanding, 8-point agreement, 25- point code of conduct and the 5-point letters sent to the United Nations:


Page 2, II, Relating to the management of Army and Arms, Relating to the Maoist army, 1: As per the commitments expressed in the letters sent to the United Nations by the Government of Nepal and the Maoists on August 9, 2006, the combatants of the Maoist army shall be confined to the following temporary cantonments. The United Nations shall verify and monitor them.",0,0,0,0,0,2,0,0,1,0,0,0,0,0,0,0,0,0,0,0,2,1,1,0,0,2,0,1,0,0,2,0,1,0,0,2,1,1,0,0,3,0,1,0,3,1,1,1,0,1,0,0,0,0,1,1,1,1,0,1,0,0,0,0,0,2,0,0,1,0,3,2,1,1,0,0,0,3,1,1,1,1,0,0,0,0,0,0,0,0,0,0,0,0,0,2,0,0,1,1,0,3,0,0,0,0,0,0,1,0,0,0,0,0,0,0,0,0,0,0,1,0,0,1,0,1,1,1,1,1,0,1,0,0,0,0,0,0,0,0,0,0,0,1,0,1,0,0,2,1,1,1,0,0,0,0,0,0,1,0,0,1,0,1,0,2,0,0,0,0,0,0,0,0,0,1,1,0,0,0,1,1,0,0,0,0,0,0,0,0,0,0,2,3,0,1,0,1,0,1,0,0,0,0,3,1,0,0,0,0,0,2,2,0,2,0,1,0,1,2,0,0,0,1,0,1,Nepal peace process,88,72.0,269.0,,7900000000000.0,,08/11/2006,2006,16,17,18,0,1,6,12,9,1996.0,2016.0,2005.0,2004.0,2001.0,2007.0,2008.0,2011.0,0.0,Nepal,0.0,790.0,524.0,NEP,NPL,,,,,,931.0,Second Nepal Maoists War,2006,5,1,1,0,1,0,0,1,1,1,0,1,0
65,66,109,Indonesia/Aceh,Government/territory,Asia and Pacific,Provisional Understanding between the Government of the Republic of Indonesia and the Leadership of the Free Aceh Movement,09/01/2001,9,1,2001,Multiparty signed/agreed,3,Intra,Pre,Proc,Joint Forum (Indonesian Government; Free Aceh Movement),Facilitator: Henry Dunant Centre  (signatory),,0,0,0,0,0,0,0,0,0,0,1,1,0,0,0,0,0,0,0,0,2,0,0,1,0,0,0,0,0,0,0,0,0,0,0,0,0,0,0,0,0,0,0,0,0,0,0,0,0,0,0,0,0,0,0,1,0,0,0,0,0,1,0,0,0,0,0,0,0,0,0,1,2,1,1,0,0,0,0,0,0,0,0,0,0,0,0,0,0,0,0,0,0,0,0,0,0,0,0,1,0,2,0,0,0,0,0,0,1,0,0,0,0,0,0,0,0,1,0,0,0,1,1,0,0,0,0,0,0,0,0,0,0,0,0,0,0,0,0,0,0,1,0,0,0,0,0,0,0,0,0,0,0,0,0,0,0,0,0,0,0,1,0,0,0,2,1,0,1,0,0,0,0,0,0,0,0,0,0,0,0,0,0,0,0,1,0,1,1,0,1,1,0,1,1,0,0,1,0,0,0,0,0,0,0,0,0,0,2,1,0,2,1,0,2,0,1,0,1,0,0,0,0,0,1,1,Aceh peace process,61,171.0,366.0,,,,09/01/2001,2001,3,3,4,0,3,0,5,4,1991.0,2011.0,2000.0,1999.0,1996.0,2002.0,2003.0,2006.0,0.0,Indonesia,0.0,850.0,360.0,INS,IDN,,,,,,912.0,Second Aceh War,2001,0,0,0,0,0,0,0,0,0,1,0,0,0
101,102,152,Colombia,Government,Americas,"Acuerdo Final entre el Gobierno Nacional y el Partido Revolucionario de los Trabajadores, don Gabriel, Ovejas, Sucre",25/01/1991,25,1,1991,Multiparty signed/agreed,15,Intra,SubComp,FrAg,"On behalf of the national government:
JESUS ANTONIO BEJARANO Presidential Council
CARLOS EDUARDO JARAMILLO Council Adviser
GONZALO DE FRANCISCO Council Adviser
ALVARO HERNÁNDEZ Council Adviser
GABRIEL RESTREPO Council Adviser
TOMAS CONCHA SANZ Council Adviser

On behalf or PRT:
VALENTIN GONZALEZ
SERGIO SIERRA
PABLO RONCALLO
RAFAEL GONZALEZ
ERNESTO FALLA",,,0,0,0,0,0,0,0,0,0,0,0,0,0,0,0,0,0,0,0,0,0,0,0,0,0,0,0,0,0,0,2,0,0,1,0,0,0,0,0,0,0,0,0,0,0,0,0,0,0,0,0,0,0,0,1,0,0,0,0,0,0,0,0,0,0,0,0,0,0,0,0,0,0,3,1,1,0,0,0,0,0,0,0,0,0,0,0,0,0,0,0,0,0,0,0,0,0,0,0,0,0,1,0,0,0,0,0,0,0,0,0,0,0,0,0,0,0,0,0,0,0,0,0,0,0,0,0,0,0,0,0,0,0,3,0,1,0,0,0,0,0,0,0,3,0,1,1,0,0,0,0,0,0,0,0,0,0,0,0,0,0,1,0,1,0,1,0,0,0,0,0,0,0,0,0,0,0,0,0,0,0,0,0,0,0,0,0,1,0,0,0,2,2,2,0,1,0,1,0,0,0,0,0,0,2,1,0,0,0,0,0,2,1,0,2,2,0,0,0,0,0,0,0,0,1,1,Colombia I - Gaviria,106,92.0,289.0,,,,25/01/1991,1991,2,2,5,0,0,0,4,7,1981.0,2001.0,1990.0,1989.0,1986.0,1992.0,1993.0,1996.0,0.0,Colombia,0.0,100.0,170.0,COL,COL,,,,,,856.0,Eighth Colombia,1991,0,0,1,0,0,0,0,0,0,1,0,0,0
112,113,163,Colombia,Government,Americas,Political Constitution of Colombia,01/07/1991,1,7,1991,Multiparty signed/agreed,128,Intra,SubComp,FrCons,"National Constituent Assembly (Political Parties, Guerrilla Groups, Civil Society, Indigenous peoples)",,,3,0,0,1,0,3,1,0,1,0,0,0,0,0,0,0,0,0,0,0,3,1,1,1,0,3,0,1,1,0,3,0,0,1,0,0,0,0,0,0,1,0,1,0,2,0,0,0,1,1,0,0,0,0,1,1,1,1,1,0,1,0,0,1,1,3,0,1,1,0,3,3,3,1,1,1,3,2,1,0,0,1,1,0,0,0,0,3,0,1,1,1,3,1,0,0,0,0,0,1,1,3,1,3,1,1,1,0,1,1,1,1,1,1,0,1,0,1,1,1,1,1,1,1,1,1,1,1,0,1,1,0,1,3,0,1,0,0,0,0,0,0,1,3,0,1,0,0,0,0,0,0,0,1,1,1,1,1,1,1,1,1,1,1,0,1,3,0,1,0,1,1,0,1,0,1,1,0,1,0,1,1,1,1,0,1,1,1,0,0,0,2,3,2,1,0,0,0,0,0,0,0,0,0,1,0,0,1,3,1,1,3,0,0,3,0,1,0,1,1,0,0,0,0,0,1,Colombia I - Gaviria,106,92.0,289.0,,,,01/07/1991,1991,18,19,26,3,12,7,29,7,1981.0,2001.0,1990.0,1989.0,1986.0,1992.0,1993.0,1996.0,0.0,Colombia,0.0,100.0,170.0,COL,COL,,,,,,856.0,Eighth Colombia,1991,8,1,1,0,1,1,1,0,1,1,0,0,0
147,148,203,Niger/Air and Azawad,Government/territory,Africa (excl MENA),Accord de Paix entre le Gouvernement de la Republique du Niger et la Coordination de la Resistance Armee (Ouagadougou Accord),09/10/1994,9,10,1994,Multiparty signed/agreed,4,Intra,SubPar,MultIss,"(Signed)
For the Government of the Republic of Niger
Maï Maï Gana, High Commissioner of the restoration of peace

(Signed)
For the Coordination of the Armed Resistance (CRA)
Mano Dayak, President
","(Signed)
For the Algerian mediation
Rabah Kerouaz, Ambassador

(Signed)
For the French mediation
Jean-François Nodinot, Plenipotentiary Minister

(Signed)
For the mediation from Burkina Faso
Salif Diallo, Minister in charge of the Missions of the Presidency of Burkina Faso.
",,0,0,0,0,0,0,0,0,0,0,0,0,0,0,0,0,0,0,0,0,0,0,0,0,0,0,0,0,0,0,0,0,0,0,0,0,0,0,0,0,2,1,0,0,0,0,0,0,0,0,0,0,0,0,0,1,1,0,0,0,0,0,0,0,0,0,0,0,0,3,0,1,0,0,0,0,0,2,0,1,0,0,0,0,0,0,0,3,1,1,0,0,0,0,0,0,0,0,0,0,0,1,0,0,0,0,0,0,1,0,0,0,0,0,0,1,0,0,0,0,0,0,0,0,0,0,0,0,0,0,0,0,0,0,0,0,0,0,0,0,0,1,0,0,0,0,0,0,0,0,0,0,0,0,0,0,0,0,0,0,0,1,0,0,1,0,0,0,0,0,0,0,0,0,0,0,0,0,0,0,0,0,0,0,0,0,0,1,2,1,0,0,0,0,0,0,0,1,0,0,0,0,0,0,0,0,0,0,0,0,0,2,1,0,0,0,0,0,0,1,0,1,0,0,0,1,Niger peace process,90,178.0,373.0,,4360000000000.0,,09/10/1994,1994,2,2,2,0,1,0,2,3,1984.0,2004.0,1993.0,1992.0,1989.0,1995.0,1996.0,1999.0,1.0,Niger,1.0,436.0,562.0,NIR,NER,,,,,,,,1994,5,1,0,0,1,1,0,0,0,1,0,0,0
153,154,210,Cote d'Ivoire,Government,Africa (excl MENA),Accra III Agreement on Cote d'Ivoire,30/07/2004,30,7,2004,Multiparty signed/agreed,7,Intra,Imp,ExtSub,"H.E. Laurent Gbagbo, President of the Republic of Cote D'Ivoire
H.E. Seydou Limana Diarra, Prime Minister of the Government of National Reconciliation
For the FPI Pascal Affi N'Guessan,
For the MFA, Innocent, Kobena Anaky
For the MJP, Gaspard Deli
For the MPCI, GUillaume SOro
For the MPIGO, Ben Souck
For the PDCI-RDA, Henri Konan Bedie
For the PIT, Francis Wodie
For the RDR, Alassane Dramane Ouattara
For the UDCI, Theodore Mel Eg
For the UDPCI, Paul Akoto Yao
","Witnessed by:

His Excellency Mathieu Kerekou
President of the Rewblic of Benin
His Excellency Blaise Compaore
President of Burkina Faso, Head of Government
His Excellency Denis Sassou Nguesso
President of the Republic of the Congo
His Excellency Laurent Gbagbo
President of the Republic of CBte d'lvoire
His Excellency El Hadj Omar Bongo Ondimba
President of the Gabonese Republic
His Excellency John Agyekum Kufuor
President of the Republic of Ghana
Chairman of ECOWAS
His Excellency Gyude Bryant
Chairman of the National Transitional Government of Liberia
His Excellency Amadou Toumani Toure
President of the Republic of Mali
His Excellency Mamadou Tanja 
President of the Republic of the Niger, Current Chairman of UEMOA
His Excellency Chief Olusegun Obasanjo 
President and Commander-in-Chief of the Armed Forces of the Federal Republic of Nigeria and Chair of the African Union
His Excellency Ahmad Tejan Kabbah
President of the Republic of Sierra Leone
His Excellency Thabo Mbeki
President of the Republic of South Africa
His Excellency Gnassingbe Eyadema
President of the Togolese Republic
His Excellency Fernando Da Piedade Dias Dos Santos
Prime Minister of Angola
His Excellency Mr. Cheikh Tidiane Sy 
Senior Minister at the Presidency representing the President of the Republic of Senegal
His Excellency Mr. Momodou Kebba Jallow 
High Commissioner of the Gambia to the Republic of Ghana representing the President of the Republic of the Gambia
His Excellency Elhadj Mamadou Falilou Bah
Ambassador of the Republic of Guinea to the Republic of Ghana representing the President of the Republic of Guinea

The following personalities also participated at the High Level consultation:
His Excellency Alpha Oumar Konare
Chairperson of the African Union Commission
His Excellency Dr. Mohamed Ibn Chambas
ECOWAS Executive Secretary



","Page 1, UNTITLED PREAMBLE
1. At the invitation of His Excellency, Mr. John Agyekum Kufuor, President of the Republic of Ghana and Chairman of ECOWAS. and His Excellency Kofi Annan, the Secretary-General of the United Nations, the following African Heads of State and Government or their duly accredited representatives, met His Excellency Mr. Laurent Gbagbo, President of the Republic of Cote d'Ivoire, His Excellency Seydou Elimane Diarra, Prime Minister of the Government of National Reconciliation and the main Ivorian political forces signatories to the Linas-Marcoussls Agreement…
",0,0,0,0,0,0,0,0,0,0,0,0,0,0,0,0,0,0,0,0,0,0,0,0,0,0,0,0,0,0,0,0,0,0,0,0,0,0,0,0,0,0,0,0,0,0,0,0,0,0,0,0,0,0,0,0,0,0,0,0,0,0,0,0,0,2,0,0,1,0,0,0,0,0,0,0,1,1,1,0,1,0,0,0,0,0,0,0,0,0,0,0,0,0,0,1,1,0,0,1,0,0,0,0,0,0,0,0,0,0,0,0,0,0,0,0,0,0,0,0,0,0,0,0,0,0,0,0,0,0,0,0,0,2,0,1,0,0,0,0,0,0,0,0,0,0,0,0,0,0,0,0,0,0,0,0,0,0,0,0,0,0,0,0,0,0,0,0,0,0,0,0,0,0,0,0,0,0,0,0,0,0,0,0,0,0,0,0,0,0,0,0,0,2,0,1,0,1,0,0,0,0,0,0,0,0,0,0,0,0,0,2,0,0,0,0,0,0,0,0,0,1,0,1,1,1,Ivory Coast peace process,5,225.0,419.0,,4370000000000.0,,30/07/2004,2004,0,0,3,0,0,0,2,4,1994.0,2014.0,2003.0,2002.0,1999.0,2005.0,2006.0,2009.0,0.0,Ivory Coast,0.0,437.0,384.0,CDI,CIV,,,,,,925.0,Cote d'Ivoire Military War,2004,2,1,0,0,1,0,0,1,0,1,0,0,0
163,164,221,Eritrea/Ethiopia,Territory,Africa (excl MENA),Agreement between the Government of the State of Eritrea and the Government of the Federal Democratic Republic of Ethiopia (Algiers Agreement),12/12/2000,12,12,2000,Multiparty signed/agreed,10,Inter,SubPar,FrparOth,"- FOR THE GOVERNMENT OF THE STATE OF ERITREA: Isais Afwerki, Pressident
- FOR THE GOVERNMENT OF THE FEDERAL DEMOCRATIC REPUBLIC OF ETHIOPIA: Meles Zenawi, Prime  Minister
","WITNESSED BY:
- For the People's Democratic Republic of Algeria Abdelaziz BOUTEFLIKA, President of the Republic
- For the United States of America, Mme Madelcinc K. ALBRIGHT, Secretary of State
- For the United Nations M. Kofi ANNAN, Secretary General
- For the Organisation of African Unity, M. Salim Ahmed Salim, Secretary General
- For the European Union, M. Rino SERRI, Special Representative of the Presidency
","- Organization of African Unity (""OAU"") Framework Agreement and the Modalities for its Implementation, which have been endorsed by the 35th ordinary session of the Assembly of Heads of State and Government, held in Algiers, Algeria, from 12 to 14 July 199",0,0,0,0,0,0,0,0,0,0,0,0,0,0,0,0,0,0,0,0,0,0,0,0,0,0,0,0,0,0,0,0,0,0,0,0,0,0,0,0,3,1,1,0,0,0,0,0,0,0,0,0,0,0,0,1,0,0,0,0,0,0,0,1,1,0,0,0,0,0,0,0,0,0,1,0,0,0,0,0,0,0,0,0,0,0,0,0,0,0,0,0,0,0,0,0,0,0,0,1,0,0,0,3,0,0,1,0,0,0,0,0,0,0,0,0,0,0,0,0,0,0,0,0,0,0,0,0,0,0,0,0,0,0,0,0,0,0,0,0,0,1,0,0,0,0,0,0,1,0,1,0,1,0,0,0,0,0,1,0,0,0,0,0,1,0,0,0,0,0,0,0,0,0,0,0,0,0,0,0,0,0,0,0,0,0,0,0,2,1,0,0,0,0,0,0,0,0,0,0,0,0,0,0,0,0,0,0,0,0,0,3,2,0,0,0,2,0,1,0,1,1,0,1,1,1,Eritrea-Ethiopia border dispute peace process,41,215.0,409.0,,53200000000000.0,,12/12/2000,2000,3,3,7,1,0,0,2,2,1990.0,2010.0,1999.0,1998.0,1995.0,2001.0,2002.0,2005.0,1.0,Eritrea,1.0,531.0,232.0,ERI,ERI,Ethiopia,530.0,231.0,ETH,ETH,,,2000,0,0,0,0,0,0,0,0,0,1,0,0,0
184,185,246,El Salvador,Government,Americas,"Agreement of the Tripartite Meeting

Spanish: Acuerdo de la Reunión Tripartita",08/09/1993,8,9,1993,Multiparty signed/agreed,9,Intra,Imp,ExtSub,"The Government of El Salvador: President Alfredo Cristiani, Minister Oscar Santamaría; General Mauricio Ernesto Vargas; Rodolfo Parker;
FMLN: Schafik Handal, Salvador Sánchez Cerén, Joaquín Víllalobos, Francisco Jovel, Eduardo Sancho and Salvador Samayoa;
ONUSAL: Augusto Ramírez-Ocampo, Michael Gucoysky and Julión Camarero.",,"Page 1, Untitled Preamble
In recent weeks, a series of bilateral meetings have taken place in an attempt to find solutions to outstanding issues for compliance with the agreements based on the document presented by the Farabundo Martí National Liberation Front (Frente Farabundo Martí para la Liberación Nacional, FMLN) to the Security Council and Secretary General on 16 July, setting out what are in its opinion 15 priority outstanding points to be implemented by the Government of El Salvador, to which a further four were added.
The review and search for solutions to these points, with which the government explicitly indicated its desire to comply, was bearing fruit. However, in some instances there remains much work to be done, as is the case with the Land Transfer Programme, which has currently only reached around 10% of the planned target. In others, legislative decrees are required and are currently pending approval by the Legislative Assembly, while other points are currently being implemented. Finally, some points have required decisive government action, while others have simply been implemented.
Following this exercise, both parties agreed that points that have already been dealt with and routine matters must not be included in the meeting scheduled with the president. Instead, only those that, not being specifically covered in the agreements and whose solution can deliver progress in the peace and reconciliation process, require a political solution at the presidential level should be included. These points will be dealt with outside the agreements and will be included in Items 7 and 10 for youth veterans.

Page 3, B. NATIONAL PUBLIC SAFETY ACADEMY
5. Guarantee the civil nature of PNC and its autonomy with respect to the Armed Forces.
... In the complementary agreements dated 22 December 1992, it was agreed, as expressed in the letters sent regarding the matter by Iqbal Riza, at the time Special Representative of the Secretary General, on 23 December 1992, that military members of the Inter-American Commission on Human Rights (IACHR) and UEA were only authorised to enter PNC based on their technical qualifications, subject to permanent separation from the armed forces and only under exceptional circumstances, without setting a precedent.
The current staff and teams of IACHR and UEA will be incorporated into PNC in this way to form the initial core of the criminal and antinarcotics investigation divisions, respectively, incorporated not as whole units, but as individual teams and staff. FMLN reiterates its position that only staff of IACHR and UEA as of 22 December 1992 can be transferred and will be assessed by the Director of PNC with verification by ONUSAL prior to joining, based on criteria of professional competence and aptitude to perform the corresponding role in the new civil police body. Following evaluation, they must also pass the specifically designed ANSP course for the doctrine and other conceptual elements of PNC, as set out in the aforementioned agreements on 22 December.

Page 7, G. FUNDING
15. Achieving the remaining funding
The government is using its own resources to meet the financial requirements derived from the agreements: it has provided SVC 36 million for the operations of ANSP, SVC 176 million for PNC and SVC 40 million for TSE. Financial support from the international community has been less than envisaged and slow in arriving.
The Secretary General of the United Nations will continue to support the government’s efforts to obtain the necessary resources.

Page 7, H. OTHER AGREEMENTS
1. Complete publication of the armed forces doctrine
Agreement met by the government.
2. Move ANSP to its permanent building.
The ANSP facilities in Comalapa have reached a high degree of satisfactory functionality, as shown by the events for the first anniversary of ANSP and the launch of the new infrastructure for its facilities in Comalapa on 7 September. As such, it is not deemed necessary to start the infrastructure works for construction of the final ANSP site due to the high cost.
3. Issue the exemptions required to import FMLN vehicles.
Agreement met by the government. The process for obtaining the exemptions is currently underway.
4. Put in motion the Law for the Protection of People Subject to Special Security.
Agreement met by the government. The process for legalising the situation of escorts is underway.",2,0,0,1,0,3,0,0,1,0,0,0,0,0,0,0,0,0,0,0,0,0,0,0,0,0,0,0,0,0,0,0,0,0,0,0,0,0,0,0,2,0,1,0,0,0,0,0,0,0,0,0,0,0,0,0,0,0,0,0,0,0,0,0,0,0,0,0,0,0,0,2,0,0,1,0,0,0,0,0,0,0,0,0,0,0,0,0,0,0,0,0,0,0,0,0,0,0,0,0,0,0,0,0,0,0,0,0,0,0,0,0,0,0,0,0,0,0,0,0,0,0,0,0,0,0,0,0,0,0,0,0,0,0,0,0,0,0,0,0,0,0,0,1,0,1,0,0,0,0,0,0,0,0,0,0,0,0,1,0,0,1,0,0,1,2,0,0,0,0,1,0,1,0,0,1,0,1,0,0,0,0,0,0,0,0,0,1,0,0,0,3,2,3,0,1,0,1,0,0,1,0,0,0,0,0,0,0,0,0,0,1,0,0,0,0,0,0,0,0,1,0,0,0,1,1,El Salvador peace process,40,120.0,316.0,,,,08/09/1993,1993,7,7,7,0,0,0,0,9,1983.0,2003.0,1992.0,1991.0,1988.0,1994.0,1995.0,1998.0,0.0,El Salvador,0.0,92.0,222.0,SAL,SLV,,,,,,817.0,El Salvador,1993,0,0,0,0,0,0,0,0,0,1,0,0,1
