538,539,667,Uganda,Government,Africa (excl MENA),Annexure to the Agreement on Accountability and Reconciliation,19/02/2008,19,2,2008,Multiparty signed/agreed,8,Intra,SubPar,MultIss,"Hon. Ruhakana Rugunda (Dr) Minister of Internal Affairs and Head of GoU Delegation

Dr David Nyekorach Matsanga, Leader of the LRA/M Delegation","Witnessed by:

H.E. Lt. General Riek Machar Teny-Dhurgon (PhD), Vice President, Government of Southern Sudan And Chief Mediator of the Peace Talks.

H.E. Andre M Kapanga (PhD), for the Government of the Democratic Republic of Congo.

H.E. Japheth R. Getugi, for the Government of the Republic of Kenya.

H.E. Nsavike G. Ndatta, for the Government of the United Republic of Tanzania.

H.E. Francisco Caetano Madeira, for the Government of the Republic of Mozambique.

Lt. Gen. (Rtd.) Gilbert Lebeko Ramano, for the Government of the Republic of South Africa.

H.E. Jan Ledang, for the Government of Norway.

Ms Anna Sundström, Poltical Advisor to the EU Special Representative for the Great Lakes Region, For the European Union.

Mr Timothy R. Shortley, Senior Advisor to the Assistant Secretary of State for African Affaris, for the Government of the United States of America.",Agreement on Accountability and Reconciliation (between GoU and LRA/M) signed on 29th June 2007.,3,1,0,1,0,3,0,0,1,0,0,0,0,0,0,0,0,0,0,0,2,0,0,1,0,0,0,0,0,0,0,0,0,0,0,0,0,0,0,0,0,0,0,0,0,0,0,0,0,1,1,1,0,0,0,0,0,0,0,0,0,0,0,0,0,0,0,0,0,0,0,0,0,0,1,1,0,0,0,0,0,0,0,0,0,0,0,0,0,0,0,0,0,0,0,0,0,0,0,0,0,0,1,3,0,0,1,1,0,0,0,0,0,0,0,0,0,0,0,0,0,0,0,0,0,0,0,0,0,0,0,0,0,0,0,0,0,0,0,0,0,0,0,0,0,0,0,0,0,0,0,0,0,1,1,1,0,0,1,0,1,0,0,0,0,0,0,0,0,0,0,0,0,0,0,0,0,0,0,0,0,0,0,0,0,0,0,0,0,0,0,0,0,0,0,0,0,0,0,0,0,0,0,2,0,0,0,0,3,1,1,2,0,0,2,1,1,0,1,2,0,1,0,0,1,1,Uganda peace process,135,118.0,314.0,,5000000000000.0,,19/02/2008,2008,8,9,12,2,0,0,2,0,1998.0,2018.0,2007.0,2006.0,2003.0,2009.0,2010.0,2013.0,0.0,Uganda,0.0,500.0,800.0,UGA,UGA,,,,,,905.0,Africa's World War,2008,0,0,0,1,0,0,0,0,0,1,0,0,0
552,553,686,Somalia,Government,Africa (excl MENA),"Decision on the High Level Committee, Djibouti Agreement",25/11/2008,25,11,2008,Multiparty signed/agreed,2,Intra,SubPar,Iss,Transitional Federal Government signed by Ahmed Abdisalaan Adan; Alliance for the Re-Liberation of Somalia signed by Abdirahman A. Warsame,"UN Special Representative of the Secretary-General signed by Ahmedou Ould-Abdallah; Minister of Religious Affairs and Waqf, Government of Djibouti.","Transitional Federal Charter; The October 26, 2008 Joint Agreement;",0,0,0,0,0,0,0,0,0,0,0,0,0,0,0,0,0,0,0,0,0,0,0,0,0,0,0,0,0,0,0,0,0,0,0,0,0,0,0,0,0,0,0,0,0,0,0,0,0,1,0,0,0,0,0,1,0,1,0,0,0,0,0,0,0,0,0,0,0,0,0,0,0,0,1,0,0,2,1,0,1,1,0,0,0,1,0,0,0,0,0,0,0,0,0,0,0,0,0,1,0,0,0,0,0,0,0,0,0,0,0,0,0,0,0,0,0,0,0,0,0,0,0,0,0,0,0,0,0,0,0,0,0,0,0,0,0,0,0,0,0,0,0,0,0,0,0,0,0,0,0,0,0,0,0,0,0,0,0,0,0,0,0,0,0,1,0,0,0,0,0,0,0,0,0,0,0,0,0,0,0,0,0,0,0,0,0,0,0,0,0,0,0,0,0,0,0,0,0,1,0,0,0,0,0,0,0,0,1,0,1,1,0,0,0,0,0,0,0,1,1,0,0,0,0,1,Somalia Peace Process,94,141.0,337.0,,5200000000000.0,,25/11/2008,2008,0,1,2,0,0,0,0,1,1998.0,2018.0,2007.0,2006.0,2003.0,2009.0,2010.0,2013.0,0.0,Somalia,0.0,520.0,706.0,SOM,SOM,,,,,,938.0,Third Somalia,2008,2,1,0,0,1,0,0,0,1,1,0,1,0
553,554,688,Kenya,Government,Africa (excl MENA),"Kenya National Dialogue and Reconciliation, Statement of Principles on Long-term Issues and Solutions",23/05/2008,23,5,2008,Multiparty signed/agreed,14,Intra,SubPar,MultIss,"Government/PNU and ODM
On the Behalf of the Government/PNU, Hon Martha Karua, Hon Sam Ongeri, Hon. Mutula Kilonzo, Hon. Moses Wetang'ula
On the Behalf of ODM, Hon. Musalia Mudavudi, Hon. William Ruto, Hon. Sally Kosgei, Hon. James Orengo","Witnessed by: For the Panel of Eminent African Personalities, H.E. Oluyemi Adeniji - Session Chair","- the Annotated Agenda and Timetable for the National Dialogue and Reconciliation
signed on 1 February 2008.
- 14 February Agreement on Agenda Item Three
- Agenda Item Four
- Agreement on the Principles of Partnership of the Coalition Government, sig",1,1,0,0,0,0,0,0,0,0,0,0,0,0,0,0,0,0,0,0,1,1,0,0,0,0,0,0,0,0,0,0,0,0,0,0,0,0,0,0,0,0,0,0,1,1,0,0,0,1,0,0,0,0,0,0,0,0,0,0,0,0,0,0,0,2,1,0,0,0,2,0,0,0,1,0,1,0,0,0,0,0,0,0,0,0,0,0,0,0,0,0,0,0,0,0,0,0,0,1,1,0,0,0,0,0,0,0,0,0,0,0,0,0,0,0,0,0,0,0,0,0,0,0,0,0,0,0,0,0,0,0,0,0,0,0,0,0,0,0,0,0,0,0,0,0,0,0,0,0,0,0,0,0,0,0,0,0,1,0,0,1,0,0,0,0,0,0,0,0,0,0,0,0,0,1,1,0,1,0,0,0,0,0,0,0,0,1,0,0,0,1,0,0,0,0,0,0,0,1,0,0,0,0,0,0,0,0,0,0,0,2,0,0,0,0,0,0,0,2,0,0,0,0,1,1,Kenya peace process,71,,,1.0,,,23/05/2008,2008,3,4,5,0,0,0,1,2,1998.0,2018.0,2007.0,2006.0,2003.0,2009.0,2010.0,2013.0,0.0,Kenya,0.0,501.0,404.0,KEN,KEN,,,,,,,,2008,0,0,0,0,0,0,0,0,0,1,0,1,0
556,557,691,Kenya,Government,Africa (excl MENA),"Kenya National Dialogue and Reconciliation - Truth, Justice and Reconciliation Commission",04/03/2008,4,3,2008,Multiparty signed/agreed,3,Intra,SubPar,Iss,"On behalf of Government/PNU:
- Hon. Martha Karua
- Hon. Sam Ongeri
- Hon. Mutula Kilonzo
- Hon. Moses Wetang'ula

On behalf of ODM:
- Hon. Musalia Mudavadi
- Hon. William Ruto
- Hon. James Orengo
- Hon. Sally Kosgei","- Witnessed by:
For the Panel of Eminent African Personalities, H.E. Oluyemi Adeniji, Session Chair",- 14 February 2008 agreement,0,0,0,0,0,0,0,0,0,0,0,0,0,0,0,0,0,0,0,0,0,0,0,0,0,0,0,0,0,0,0,0,0,0,0,0,0,0,0,0,1,0,1,0,0,0,0,0,0,1,0,0,0,0,0,0,0,0,0,0,0,0,0,0,0,2,1,0,0,0,0,0,0,0,0,0,0,0,0,0,0,0,0,0,0,0,0,0,0,0,0,0,0,0,0,0,0,0,0,1,0,0,0,0,0,0,0,0,0,0,0,0,0,0,0,0,0,0,0,0,0,0,0,0,0,0,0,0,0,0,0,0,0,0,0,0,0,0,0,0,0,0,0,0,0,0,0,0,0,0,0,0,0,0,0,0,0,0,0,0,0,0,0,0,1,0,0,0,0,0,0,0,0,0,0,1,0,1,0,0,0,0,0,0,0,0,0,0,0,0,0,0,0,0,0,0,0,0,0,1,0,0,0,0,2,1,0,0,0,0,0,3,0,0,2,0,0,0,0,2,0,1,0,0,0,1,Kenya peace process,71,,,1.0,,,04/03/2008,2008,1,2,3,0,0,0,0,1,1998.0,2018.0,2007.0,2006.0,2003.0,2009.0,2010.0,2013.0,0.0,Kenya,0.0,501.0,404.0,KEN,KEN,,,,,,,,2008,0,0,1,0,0,0,0,0,0,1,0,1,0
561,562,696,Kenya,Government,Africa (excl MENA),Kenya National Dialogue and Reconciliation: Public Statement,04/02/2008,4,2,2008,Multiparty signed/agreed,4,Intra,SubPar,MultIss,"Government (PNU-Party National Unity) and ODM (Orange Democratic Movement);
Government (PNU-Party National Unity) singed by Hon. Martha Karua, Hon. Sam Ongeri, Hon Tutula Kilonwo, Hon. Moses Wetang'ula
ODM signed by Hon. Musalisa Mudavidi, Hon. William Ruto, Hon. Sally Kosgei, Hon. James Orengo
","Witnessed by: For the Panel of Eminent African Personalities, H.E. Kofi A. Annan, Chairperson",,2,0,0,1,0,2,0,0,1,0,2,0,0,1,0,0,0,0,0,0,2,0,0,1,0,0,0,0,0,0,0,0,0,0,0,0,0,0,0,0,3,0,1,0,0,0,0,0,0,1,0,0,0,0,1,0,0,0,0,0,0,0,0,0,0,0,0,0,0,2,0,1,0,0,1,0,0,0,0,0,0,0,0,0,0,0,0,0,0,0,0,0,0,0,0,0,0,0,0,1,0,0,0,0,0,0,0,0,1,0,0,0,0,0,0,0,0,1,0,0,0,1,0,0,0,0,0,0,0,0,0,0,0,0,0,0,0,2,0,1,0,1,0,3,0,1,0,0,0,0,0,0,0,0,0,0,0,0,0,0,0,1,0,0,0,0,0,0,0,0,0,0,0,0,0,0,0,0,0,0,0,0,0,0,0,0,0,1,0,0,0,0,0,0,0,0,0,0,0,0,0,0,0,0,0,0,0,0,0,0,0,2,0,0,2,0,0,0,0,3,0,1,0,0,1,1,Kenya peace process,71,,,1.0,,,04/02/2008,2008,11,12,13,0,2,0,4,0,1998.0,2018.0,2007.0,2006.0,2003.0,2009.0,2010.0,2013.0,0.0,Kenya,0.0,501.0,404.0,KEN,KEN,,,,,,,,2008,0,0,0,0,0,0,0,0,0,1,0,0,0
566,567,701,Cote d'Ivoire,Government,Africa (excl MENA),UN Security Council Resolution 1721,01/11/2006,1,11,2006,Unilateral document,6,InterIntra,Imp,ImpMod,United Nations Security Council,,"Page 1, UNTITLED PREAMBLE
…
Recalling that it endorsed the Agreement signed by the Ivorian political forces in Linas-Marcoussis on 24 January 2003 (S/2003/99) (the Linas-Marcoussis Agreement) approved by the Conference of Heads of State on Côte d’Ivoire, held in Paris on 25 and 26 January 2003, the Agreement signed in Accra on 30 July 2004 (the Accra III Agreement) and the Agreement signed in Pretoria on 6 April 2005 (the Pretoria  Agreement)
…
Having taken note of the decision of the Peace and Security Council of the African Union adopted at its 64th meeting at the level of Heads of State and Government, held on 17 October 2006 in Addis Ababa (“the decision of the Peace and Security Council”) (S/2006/829),
Having heard on 25 October 2006 the report by M. Saïd Djinnit, Commissioner of the African Union,
Having taken note of the report of the Secretary-General dated 17 October 2006 (S/2006/821), in particular its paragraphs 68 to 80
…
Acting under Chapter VII of the Charter of the United Nations,

Page 2, Section 2
The Security Council:
Takes note of the tenth final communiqué of the IWG dated 8 September 2006;

Page 3, Section 10
The Security Council:
Recalls paragraph 10 article (iii) of the decision of the Peace and Security Council of the African Union dated 6 October 2005 (S/2005/639) and the statement of the President of the Council dated 9 December 2005 (S/PRST/2005/60), reaffirms the provisions of paragraphs 6 and 7 of resolution 1633 (2005), and recalls that the Prime Minister shall have full authority over the Government that he will establish

Page 4, Section 18
The Security Council:
Encourages the Prime Minister to seek, as appropriate, the active involvement of civil society in moving the peace process forward, and urges the Ivorian parties, the High Representative for the Elections together with UNOCI to take account of the rights and resources of women and of gender considerations as set out in resolution 1325 (2000) as cross-cutting issues in the implementation of the peace process including through the consultations with local and international women’s groups

Page 4, Section 19
The Security Council:
Demands that all Ivorian parties end all incitement to hatred and violence, in radio and television broadcasting as well as in any other media, and urges the Prime Minister to establish and implement without delay a code  of conduct for the media, in conformity with the decisions taken at Yamoussoukro on 5 July 2006 and the decision of the Peace and Security Council

Page 5, Section 23
The Security Council:
Requests UNOCI, consistent with its mandate in resolution 1609 to protect United Nations personnel, to provide security to the High Representative for the Elections, within its capabilities and its areas of deployment

Page 6, Section 32
The Security Council:
Underlines that it is fully prepared to impose targeted measures against persons to be designated by the Committee established by paragraph 14 of resolution 1572 (2004) who are determined to be, among other things, blocking the implementation of the peace process,  including by attacking or obstructing the action of UNOCI, of the French forces which support it, of the High Representative for the Elections, of the IWG, of the Mediator or his representative in Côte d’Ivoire, responsible for serious violations of human rights and international humanitarian law committed in Côte d’Ivoire since 19 September 2002, inciting publicly hatred and violence or in violation of the arms embargo, as provided in resolutions 1572 (2004) and 1643 (2005);
",1,1,0,0,0,0,0,0,0,0,0,0,0,0,0,0,0,0,0,0,0,0,0,0,0,0,0,0,0,0,0,0,0,0,0,0,0,0,0,0,1,1,0,0,0,0,0,0,0,1,0,0,0,0,0,1,1,0,0,0,0,0,0,0,1,2,0,0,1,0,0,1,0,0,1,0,0,0,0,0,0,0,0,0,0,0,0,0,0,0,0,0,0,0,0,2,1,0,0,1,1,0,0,1,1,0,1,0,1,0,0,0,0,0,0,1,0,0,0,0,0,0,0,0,0,0,0,0,0,0,0,0,0,0,0,0,0,0,0,0,0,1,0,1,0,1,0,0,2,0,0,1,0,0,0,0,0,0,0,0,0,0,0,0,1,0,0,0,0,0,0,0,0,0,0,0,0,0,0,0,0,0,0,0,0,0,0,1,0,0,0,0,2,2,0,1,0,1,0,0,0,0,0,0,0,0,0,0,0,0,0,1,0,0,0,0,0,0,0,0,1,0,0,1,1,1,Ivory Coast peace process,5,225.0,419.0,,,,01/11/2006,2006,2,3,5,2,1,0,6,7,1996.0,2016.0,2005.0,2004.0,2001.0,2007.0,2008.0,2011.0,0.0,Ivory Coast,0.0,437.0,384.0,CDI,CIV,,,,,,925.0,Cote d'Ivoire Military War,2006,2,1,0,0,0,0,0,1,1,1,0,0,0
567,568,702,Burundi,Government,Africa (excl MENA),"Dar-es-Salaam Agreement on Principles Towards lasting Peace, Security, and Stability in Burundi",18/06/2006,18,6,2006,Multiparty signed/agreed,11,Intra,SubComp,FrAg,"The Governenment of Burundi and the Palipehutu-FNL

In the presence of :
...
-	H.E. Pierre Nkurunziza, President of the Republic of Burundi

Signatory Party:
For the Government of Burundi - Name of the Representative: H.E. Evariste Ndayishimiye
Title: Head of the Burundi Government Delegation

For the Palipehutu-FNL - Name of the Representative: H.E. Agathon Rwasa
Title: Chairman","Having participated in the talks facilitated by the Minister of Safety and Security of the Republic of South Africa, His Excellency Charles Nqakula, in terms of the mandate of the Regional Initiative for Peace in Burundi.

In the presence of :
-	H.E. Jakaya Mrisho Kikwete, Deputy Chairperson of the Regional Initiative on the Burundi Peace Process;
-	H.E. Charles Nqakula, Facilitaor;
-	H.E. Ambassador Mamadou Bah, Representative of the Chairperson of the African Union Commission;
-	H.E. Ambassador Nureldin Satti, Special Representative of the United Nations, Secretary General Kofi Anan;
",,0,0,0,0,0,0,0,0,0,0,0,0,0,0,0,0,0,0,0,0,1,1,0,0,0,1,1,0,0,0,0,0,0,0,0,0,0,0,0,0,2,0,1,0,1,1,0,0,0,1,1,1,0,0,0,0,0,0,0,0,0,0,0,0,0,0,0,0,0,0,0,0,0,0,1,0,0,0,0,0,0,0,0,0,0,0,0,0,0,0,0,0,0,0,0,1,0,0,1,1,0,1,0,0,0,0,0,0,0,0,0,0,0,0,0,0,0,0,0,0,0,0,0,0,0,0,0,0,0,0,0,0,0,0,0,0,0,0,0,0,0,0,0,0,0,0,0,0,0,0,0,0,0,0,0,0,0,0,0,0,0,1,0,0,0,0,0,0,0,0,0,0,0,0,0,0,0,0,0,0,0,0,0,0,0,0,0,0,2,1,0,2,2,0,0,0,0,1,0,0,0,0,0,0,2,1,0,0,0,0,0,3,2,0,0,0,0,0,0,2,1,0,0,1,0,1,Burundi peace process,19,90.0,287.0,,5160000000000.0,,18/06/2006,2006,5,6,7,0,0,0,1,8,1996.0,2016.0,2005.0,2004.0,2001.0,2007.0,2008.0,2011.0,0.0,Burundi,0.0,516.0,108.0,BUI,BDI,,,,,,918.0,Third Burundi,2006,1,1,1,0,0,0,0,1,1,1,0,0,0
587,588,726,Kenya,Government,Africa (excl MENA),Kenyan National Dialogue and Reconciliation: How to Resolve the Political Crisis,14/02/2008,14,2,2008,Multiparty signed/agreed,5,Intra,SubPar,FrparOth,"On the Government/PNU: Hon. Martha Karua, Hon. Sam Ongeri, Hon. Mutula Kilonwo, Hon. Moses Wetang'ula
On the behalf of ODM: Hon. Musalia Mudavadi, Hon. William Ruto, Hon. Sally Kosgei, Hon. James Orengo","Witnessed by: For the Panel of Eminent African Personalities: H.E. Kofi A. Annan, Chairperson",,1,1,0,0,0,0,0,0,0,0,0,0,0,0,0,0,0,0,0,0,0,0,0,0,0,0,0,0,0,0,0,0,0,0,0,0,0,0,0,0,1,1,0,0,0,0,0,0,0,0,0,0,0,0,0,0,0,0,0,0,0,0,0,0,0,0,0,0,0,0,2,1,1,0,0,0,0,0,0,0,0,0,0,0,0,0,0,0,0,0,0,0,0,0,0,0,0,0,0,1,1,2,0,0,0,0,0,0,0,0,0,0,0,0,0,0,0,0,0,0,0,0,0,0,0,0,0,0,0,0,0,0,0,0,0,0,0,0,0,0,0,0,0,0,0,0,0,0,0,0,0,0,0,0,0,0,0,0,1,0,0,1,0,0,0,0,0,0,0,0,0,0,0,0,0,1,1,0,0,0,0,0,0,0,0,0,0,1,0,0,0,1,0,0,0,0,0,0,0,1,0,0,0,2,0,0,0,0,1,1,0,2,0,0,0,0,0,0,0,2,0,0,0,0,0,1,Kenya peace process,71,,,1.0,,,14/02/2008,2008,2,2,3,0,0,0,3,2,1998.0,2018.0,2007.0,2006.0,2003.0,2009.0,2010.0,2013.0,0.0,Kenya,0.0,501.0,404.0,KEN,KEN,,,,,,,,2008,0,0,0,1,0,0,0,0,0,1,0,1,0
592,593,733,Nepal,Government,Asia and Pacific,The Seven Point Agreement,01/11/2011,1,11,2011,Multiparty signed/agreed,3,Intra,Imp,ImpMod,"Signed by:
Pushpa Kamal Dahal (Prachanda), Chairman, UCPN (Maoist)
Sushil Koirala, President , Nepali Congress
Jhala Nath Khanal, Chairman, CPN (UML)
Bijay Kumar Gachchhadar, On behalf of United Democratic Madhesi Front",,"Page 1, Untitled Preamble:...Therefore, as per the Comprehensive Peace Agreement (CPA) 2006 and various other understandings reached between the political parties at different times, the following understanding has been reached to complete the remaining task of constitution-drafting and move forward on the basis of national consensus.

Page 2, 4. Formation of commissions as per previous agreement: a) As per the CPA, the bill on the Truth and Reconciliation Commission (TRC) and the Commission to Investigate Forced Disappearances would be endorsed by the legislature parliament after building consensus in the spirit of reconciliation. These commissions would be formed within a month.
b)	The legal cases of the conflict period would be looked into as per the letter and spirit of the Comprehensive Peace Agreement and the Interim Constitution, 2007.

Page 2, 5. Relief packages for conflict victims: Relief packages would be made available without discrimination to the kin of those killed and disappeared, maimed, displaced and those whose properties were damaged in the armed conflict. The relief packages to be distributed after the signing of the Comprehensive Peace Agreement would be provided equally and without discrimination.

Page 2, 6. Implementation of past agreements and trust-building:
...b) The rights of the peasants would be guaranteed as per the letter and spirit of the Comprehensive Peace Agreement, Interim Constitution 2007, and scientific land reforms.",1,0,0,0,1,3,0,0,1,0,0,0,0,0,0,0,0,0,0,0,0,0,0,0,0,0,0,0,0,0,0,0,0,0,0,0,0,0,0,0,3,0,1,0,2,0,0,1,0,0,0,0,0,0,1,1,1,0,0,0,0,0,0,0,0,1,0,0,1,0,3,0,0,0,0,0,0,0,0,0,0,0,0,0,0,0,0,0,0,0,0,0,0,0,0,3,1,1,0,0,1,0,0,0,0,0,0,0,0,0,0,0,0,0,0,0,0,0,0,0,0,0,0,0,0,0,0,0,0,0,0,0,0,0,0,0,0,0,0,0,0,0,0,0,0,0,0,0,0,0,0,0,0,0,0,0,0,0,0,0,0,1,0,0,0,1,0,0,0,0,0,0,0,0,0,1,0,1,1,0,0,0,0,0,0,0,0,0,0,0,0,0,3,3,0,1,0,1,0,0,0,0,0,0,0,0,0,0,0,0,0,2,0,0,2,2,2,0,1,2,0,0,0,0,0,1,Nepal peace process,88,72.0,269.0,,,,01/11/2011,2011,9,9,9,0,0,0,1,10,2001.0,2021.0,2010.0,2009.0,2006.0,2012.0,2013.0,2016.0,0.0,Nepal,0.0,790.0,524.0,NEP,NPL,,,,,,931.0,Second Nepal Maoists War,2011,3,1,0,0,0,0,0,1,0,1,0,0,0
646,647,793,Democratic Republic of Congo,Government,Africa (excl MENA),Outcome Documents from the Conclusion of the Kampala Dialogue between the Government of the Democratic Republic of the Congo and the M23,12/12/2013,12,12,2013,Multiparty signed/agreed,24,Intra,SubPar,MultIss,"1. Government of Democratic Republic of Congo
2. M23 Movement","H.E. Ban Ki-moon, Secretary General of the United Nations
H.E. Yoweri K. Museveni, President of the Republic of Uganda and Chairperson of the ICGLR;

(Page 1, Untitled Preamble: H.E. Yoweri K. Museveni
President of the Republic of Uganda and Chairperson of ICGLR

H.E. Dr. Joyce Banda
President of the Republic of Malawi and Chairperson of SADC

2. Formal dialogue stared on 9th December 2012 and ended on 3rd November 2013. The facilitation of the dialogue was carried out on behalf of President Museveni by Uganda's Minister of Defense, Dr. Crispus W.C.B. Kiyonga, with the support of the ICGLR Secretariat and technical assistance from Mrs. Sahle-Work Zewde, Director General of the United Nations Office at Nairobi and from the United Nations, New York)","Declaration of the Heads of State and Government of the International Conference on the Great Lakes Region (ICGLR)

Framework Agreement for Peace, Security and Cooperation for the Democratic Republic of Congo and the Region",3,1,0,1,0,2,0,0,1,0,2,0,0,1,0,0,0,0,0,0,2,0,0,1,0,0,0,0,0,0,0,0,0,0,0,0,0,0,0,0,2,0,1,0,0,0,0,0,0,1,0,0,0,0,1,0,0,0,0,0,0,0,0,0,0,0,0,0,0,1,0,0,0,2,1,0,1,0,0,0,0,0,0,0,0,0,0,0,0,0,0,0,0,0,0,0,0,0,0,1,0,1,0,0,0,0,0,0,0,0,0,0,0,0,0,0,0,0,0,0,0,0,0,1,1,0,0,0,0,0,0,0,0,0,0,0,0,0,0,0,0,1,0,2,0,1,0,0,1,0,1,0,0,0,0,0,0,0,1,0,0,1,1,1,1,0,0,0,0,0,0,0,0,0,0,1,1,1,0,0,0,0,0,0,0,0,0,1,1,0,1,1,0,3,0,1,0,1,0,0,0,0,0,0,3,1,0,0,1,1,0,1,2,0,0,0,1,0,1,3,0,1,0,1,1,1,Eastern DRC processes,34,86.0,283.0,,,,12/12/2013,2013,11,12,13,0,0,1,3,6,2003.0,2023.0,2012.0,2011.0,2008.0,2014.0,2015.0,2018.0,0.0,DRCongo(Zaire),0.0,490.0,180.0,DRC,COD,,,,,,,,2013,0,0,1,0,0,0,0,0,0,1,0,0,0
651,652,800,Honduras,Government,Americas,Decreto ejecutivo para la creación de la comisión de la verdad y reconciliación,13/04/2010,13,4,2010,Multiparty signed/agreed,4,Intra,SubPar,Iss,The government,,"Page 1, Untitled Preamble
... CONSIDERING: that the President of the Republic of Honduras, in line with the commitments of the Tegucigalpa– San José Agreement, dated October 2009, with the principal objective of the peace, harmony and peaceful coexistence of the people of Honduras and the full exercise of their democratic freedoms, accepts with full conviction the need to clarify the events of the recent political and social crisis in our country to create a basis for ensuring these situations are not repeated and bring about the reconciliation of the people of Honduras and understanding between them.

Page 1, Untitled Preamble
... CONSIDERING: that in this respect the Government of Honduras has accepted the organisation and launch of the Truth and Reconciliation Commission as responsibility of the current government, in line with the recommendation agreed by the negotiators of the parties in the aforementioned Tegucigalpa – San José Agreement and in the terms negotiated by the parties in October 2009.

Page 1-2, THEREFORE:
The President of the Republic of Honduras in Council of Ministers and in application of Articles 1, 2, 3, 4, 5, 15, 235, 245, Numbers 1 and 11, of the Constitution of the Republic, Articles 11, 13, 14, 117 and other applicable articles of the General Law of Public Administration, and Clause 6, of the Tegucigalpa – San José Agreement for national reconciliation and the strengthening of democracy in Honduras.

Page 2, DECREE:
Article 3. ... The commission and its staff, assets and payments will enjoy the privileges and immunities established in Articles 2, 3, 4, 5, 7 and 10 of the Agreement on Privileges and Immunities of the Organisation of American States (OAS), adopted 15 May 1949, to which the Republic of Honduras is party, its government having deposited its ratification document on 25 August 1964, which will be formalised by an exchange of letters between the Honduran Secretary of Foreign Relations and the General secretary of OAS.",0,0,0,0,0,0,0,0,0,0,0,0,0,0,0,0,0,0,0,0,0,0,0,0,0,0,0,0,0,0,0,0,0,0,0,0,0,0,0,0,0,0,0,0,0,0,0,0,0,0,0,0,0,0,0,1,1,0,1,0,0,0,0,0,0,0,0,0,0,0,0,0,0,0,1,0,0,0,0,0,0,0,0,0,0,0,0,0,0,0,0,0,0,0,0,0,0,0,0,1,0,1,0,1,0,0,1,0,1,0,0,0,0,0,0,0,0,0,0,0,0,0,1,1,0,0,0,0,0,0,0,0,1,0,0,0,0,0,0,0,0,0,0,1,1,0,0,0,0,0,0,0,0,0,0,0,0,0,0,0,0,0,0,0,1,0,0,0,0,0,0,0,0,0,0,0,0,0,0,0,0,0,0,0,0,0,0,0,0,0,0,0,0,0,0,0,0,0,0,0,0,0,0,0,0,0,0,0,0,0,0,3,0,0,0,0,0,0,0,2,0,0,0,0,0,1,Honduran peace process,55,,,,,,13/04/2010,2010,0,0,2,1,1,1,4,0,2000.0,2020.0,2009.0,2008.0,2005.0,2011.0,2012.0,2015.0,0.0,Honduras,0.0,91.0,340.0,HON,HND,,,,,,,,2010,0,0,0,0,0,0,0,0,0,1,0,0,0
660,661,813,Mali/Azawad,Government/territory,Africa (excl MENA),Accord préliminaire à l’élection présidentielle et aux pourparlers inclusifs de paix au Mali (Accord préliminaire de Ouagadougou),18/06/2013,18,6,2013,Multiparty signed/agreed,9,Intra,SubPar,MultIss,"(Signed)
Pour le Gouvernement d'union nationale de la République du Mali, le Ministre de la Défense et des Anciens Combattants et P/D:
Colonel Moussa Sinko COULIBALY
Ministre de l' Administration Territotiale de la Décentralisation et de l' Aménagement du Territoire.

(Signed)
Pour le Mouvement national pour la libération de l'Azawad
Bilal Ag CHERIF

(Signed)
Pour le Haut Conseil pour l'unité de l'Azawad
Alghabass Ag INTALLA

","(Signed)
Le Médiateur
Blaise Compaore
Président du Faso

(Signed)
Le Médiateur associé
Goodluck Ebele Jonathan
Président de la République Fédérale du Nigeria

Témoins

(Signed)
Haut Représentant de l'Union Africaine et Chef de la MISMA
Pierre BUYOYA

(Signed)
Représentant Spécial du Secrétaire Général des Nations Unies et Chef de Mission de la MINUSMA
Bert Koenders

(Signed)
Représentant de L'Organisation de la Coopération Islamique (OCI)
Yipene Djibril Bassole

(Signed)
Représentant l'Union Européenne (UE)
Michel REVEYRAND de MENTHON","Page 3, Preamble:
[...]
Reaffirming their respect for the principles of the communique issued at Ouagadougou on December 4, 2012, including:
-	the use of dialogue and negotiation to reach a fair and definitive political solution to the crisis;
-	respect for national unity and the territorial integrity of Mali;
-	respect for the republican and secular nature of the State;
-	respect for Human Rights, human dignity, and fundamental and religious liberties;
-	protection of the national heritage;
-	respect for equality of all Malian citizens;
-	rejection of all forms of terrorism and extremism;
-	respect for Malian communities.
[...]",1,1,0,0,0,0,0,0,0,0,0,0,0,0,0,0,0,0,0,0,0,0,0,0,0,0,0,0,0,0,0,0,0,0,0,0,0,0,0,0,1,0,1,0,0,0,0,0,0,1,0,0,0,0,0,1,1,0,0,0,0,0,0,0,0,0,0,0,0,1,0,2,0,0,1,0,1,0,0,0,0,0,0,0,0,0,0,0,0,0,0,0,0,0,0,0,0,0,0,1,1,1,0,0,0,0,0,0,1,0,1,0,0,1,0,1,0,0,1,0,0,1,0,0,0,0,0,0,0,0,0,0,0,0,0,0,0,0,0,0,0,1,0,1,0,1,0,0,0,0,0,0,0,0,0,0,0,0,0,0,0,1,0,0,1,0,0,0,0,0,0,0,0,0,0,0,0,0,0,0,1,0,0,1,0,0,0,1,3,1,0,0,1,2,0,1,0,1,0,0,1,0,1,0,0,0,0,0,0,0,0,2,1,0,0,0,0,0,0,2,1,1,0,1,1,1,Inter-Azawad peace process,81,177.0,372.0,,,,18/06/2013,2013,2,3,4,0,5,0,7,8,2003.0,2023.0,2012.0,2011.0,2008.0,2014.0,2015.0,2018.0,0.0,Mali,0.0,432.0,466.0,MLI,MLI,,,,,,,,2013,0,0,0,0,0,0,0,0,0,1,0,0,1
